{
  "abi_version": "0.1",
  "target": "atlas",
  "backend": "atlas-xdsl",
  "tensors": {
    "A0": {
      "shape": [
        12,
        1024,
        1024
      ],
      "dtype": "fp8_e4m3",
      "role": "input",
      "base": 2415919104
    },
    "W": {
      "shape": [
        12,
        1024,
        64
      ],
      "dtype": "fp8_e4m3",
      "role": "weight",
      "base": 2428502016
    },
    "Y0": {
      "shape": [
        12,
        1024,
        64
      ],
      "dtype": "bf16",
      "role": "output",
      "base": 2429288448
    }
  },
  "commands": [
    {
      "opcode": "RES_PACK",
      "operands": {
        "src": "W",
        "dst": "W_resident"
      },
      "attributes": {
        "layout": "packed_rhs"
      }
    },
    {
      "opcode": "BATCHED_MATMUL",
      "operands": {
        "src": "A0",
        "dst": "Y0",
        "rhs": "W_resident"
      },
      "attributes": {
        "name": "Y0",
        "batch": 12,
        "output_dtype": "bf16"
      }
    },
    {
      "opcode": "EVICT",
      "operands": {
        "handle": "W_resident"
      }
    }
  ],
  "kernel_abi": {
    "kind": "whole_program",
    "args": [
      {
        "tensor": "A0",
        "access": "read"
      },
      {
        "tensor": "W",
        "access": "read"
      },
      {
        "tensor": "Y0",
        "access": "write"
      }
    ],
    "outputs": [
      "Y0"
    ]
  }
}